Sheet: Лист1
A1: №
A2: 1 | B2: 4.0999999999999996 | C2: =R[1]C[-1]-R2C6 -> -0.89363636363636267 | D2: =RC[-1]^2 -> 0.79858595041322145 | F2: =AVERAGE(R[1]C[-4]:R[100]C[-4]) -> 5.003636363636363 | G2: =SUM(RC[-4]:R[99]C[-4]) -> -5.0036363636363106 | H2: =SQRT(1/99 * RC[1]) -> 0.68434491103429407 | I2: =SUM(RC[-5]:R[99]C[-5]) -> 46.364467768595041 | J2: =1/SQRT(RC[-2]*(2*PI())) -> 0.48225034252759508 | K2: =(R[-1]C[-9]-R[1]C[-9])/9.228 -> -0.4453836150845254
A3: 2 | B3: 4.1100000000000003 | C3: =R[1]C[-1]-R2C6 -> -0.84363636363636285 | D3: =RC[-1]^2 -> 0.71172231404958541
A4: 3 | B4: 4.16 | C4: =R[1]C[-1]-R2C6 -> -0.79363636363636303 | D4: =RC[-1]^2 -> 0.6298586776859495
A5: 4 | B5: 4.21 | C5: =R[1]C[-1]-R2C6 -> -0.73363636363636342 | D5: =RC[-1]^2 -> 0.53822231404958643
A6: 5 | B6: 4.2699999999999996 | C6: =R[1]C[-1]-R2C6 -> -0.72363636363636274 | D6: =RC[-1]^2 -> 0.52364958677685824
A7: 6 | B7: 4.28 | C7: =R[1]C[-1]-R2C6 -> -0.64363636363636267 | D7: =RC[-1]^2 -> 0.41426776859504011
A8: 7 | B8: 4.3600000000000003 | C8: =R[1]C[-1]-R2C6 -> -0.63363636363636289 | D8: =RC[-1]^2 -> 0.40149504132231312
A9: 8 | B9: 4.37 | C9: =R[1]C[-1]-R2C6 -> -0.6236363636363631 | D9: =RC[-1]^2 -> 0.3889223140495861
A10: 9 | B10: 4.38 | C10: =R[1]C[-1]-R2C6 -> -0.6236363636363631 | D10: =RC[-1]^2 -> 0.3889223140495861
A11: 10 | B11: 4.38 | C11: =R[1]C[-1]-R2C6 -> -0.57363636363636328 | D11: =RC[-1]^2 -> 0.32905867768594999
A12: 11 | B12: 4.43 | C12: =R[1]C[-1]-R2C6 -> -0.5636363636363626 | D12: =RC[-1]^2 -> 0.31768595041322195
A13: 12 | B13: 4.4400000000000004 | C13: =R[1]C[-1]-R2C6 -> -0.55363636363636282 | D13: =RC[-1]^2 -> 0.30651322314049495
A14: 13 | B14: 4.45 | C14: =R[1]C[-1]-R2C6 -> -0.54363636363636303 | D14: =RC[-1]^2 -> 0.29554049586776793
A15: 14 | B15: 4.46 | C15: =R[1]C[-1]-R2C6 -> -0.52363636363636257 | D15: =RC[-1]^2 -> 0.27419504132231293
A16: 15 | B16: 4.4800000000000004 | C16: =R[1]C[-1]-R2C6 -> -0.52363636363636257 | D16: =RC[-1]^2 -> 0.27419504132231293
A17: 16 | B17: 4.4800000000000004 | C17: =R[1]C[-1]-R2C6 -> -0.50363636363636299 | D17: =RC[-1]^2 -> 0.25364958677685884
A18: 17 | B18: 4.5 | C18: =R[1]C[-1]-R2C6 -> -0.42363636363636292 | D18: =RC[-1]^2 -> 0.17946776859504071
A19: 18 | B19: 4.58 | C19: =R[1]C[-1]-R2C6 -> -0.41363636363636314 | D19: =RC[-1]^2 -> 0.17109504132231362 | H19: ∑
A20: 19 | B20: 4.59 | C20: =R[1]C[-1]-R2C6 -> -0.40363636363636335 | D20: =RC[-1]^2 -> 0.16292231404958654 | F20: =SQRT((1/(100*(100-1)))*RC[2]) -> 6.8434491103429404E-2 | H20: =SUM(R[-18]C[-4]:R[81]C[-4]) -> 46.364467768595041
A21: 20 | B21: 4.5999999999999996 | C21: =R[1]C[-1]-R2C6 -> -0.38363636363636289 | D21: =RC[-1]^2 -> 0.14717685950413165
A22: 21 | B22: 4.62 | C22: =R[1]C[-1]-R2C6 -> -0.3736363636363631 | D22: =RC[-1]^2 -> 0.13960413223140455 | F22: =R[-2]C*1.984 -> 0.13577403034920393
A23: 22 | B23: 4.63 | C23: =R[1]C[-1]-R2C6 -> -0.35363636363636264 | D23: =RC[-1]^2 -> 0.12505867768594972
A24: 23 | B24: 4.6500000000000004 | C24: =R[1]C[-1]-R2C6 -> -0.35363636363636264 | D24: =RC[-1]^2 -> 0.12505867768594972
A25: 24 | B25: 4.6500000000000004 | C25: =R[1]C[-1]-R2C6 -> -0.34363636363636285 | D25: =RC[-1]^2 -> 0.1180859504132226
A26: 25 | B26: 4.66 | C26: =R[1]C[-1]-R2C6 -> -0.3136363636363626 | D26: =RC[-1]^2 -> 9.8367768595040678E-2
A27: 26 | B27: 4.6900000000000004 | C27: =R[1]C[-1]-R2C6 -> -0.3136363636363626 | D27: =RC[-1]^2 -> 9.8367768595040678E-2
A28: 27 | B28: 4.6900000000000004 | C28: =R[1]C[-1]-R2C6 -> -0.29363636363636303 | D28: =RC[-1]^2 -> 8.6222314049586427E-2
A29: 28 | B29: 4.71 | C29: =R[1]C[-1]-R2C6 -> -0.28363636363636324 | D29: =RC[-1]^2 -> 8.0449586776859275E-2
A30: 29 | B30: 4.72 | C30: =R[1]C[-1]-R2C6 -> -0.27363636363636257 | D30: =RC[-1]^2 -> 7.4876859504131643E-2
A31: 30 | B31: 4.7300000000000004 | C31: =R[1]C[-1]-R2C6 -> -0.25363636363636299 | D31: =RC[-1]^2 -> 6.4331404958677355E-2
A32: 31 | B32: 4.75 | C32: =R[1]C[-1]-R2C6 -> -0.22363636363636274 | D32: =RC[-1]^2 -> 5.0013223140495472E-2
A33: 32 | B33: 4.78 | C33: =R[1]C[-1]-R2C6 -> -0.20363636363636317 | D33: =RC[-1]^2 -> 4.146776859504113E-2
A34: 33 | B34: 4.8 | C34: =R[1]C[-1]-R2C6 -> -0.20363636363636317 | D34: =RC[-1]^2 -> 4.146776859504113E-2
A35: 34 | B35: 4.8 | C35: =R[1]C[-1]-R2C6 -> -0.19363636363636338 | D35: =RC[-1]^2 -> 3.7495041322313953E-2
A36: 35 | B36: 4.8099999999999996 | C36: =R[1]C[-1]-R2C6 -> -0.17363636363636292 | D36: =RC[-1]^2 -> 3.0149586776859257E-2
A37: 36 | B37: 4.83 | C37: =R[1]C[-1]-R2C6 -> -0.16363636363636314 | D37: =RC[-1]^2 -> 2.6776859504132066E-2
A38: 37 | B38: 4.84 | C38: =R[1]C[-1]-R2C6 -> -0.15363636363636335 | D38: =RC[-1]^2 -> 2.3604132231404871E-2
A39: 38 | B39: 4.8499999999999996 | C39: =R[1]C[-1]-R2C6 -> -0.15363636363636335 | D39: =RC[-1]^2 -> 2.3604132231404871E-2
A40: 39 | B40: 4.8499999999999996 | C40: =R[1]C[-1]-R2C6 -> -0.14363636363636267 | D40: =RC[-1]^2 -> 2.0631404958677411E-2
A41: 40 | B41: 4.8600000000000003 | C41: =R[1]C[-1]-R2C6 -> -0.1236363636363631 | D41: =RC[-1]^2 -> 1.5285950413223007E-2
A42: 41 | B42: 4.88 | C42: =R[1]C[-1]-R2C6 -> -0.1236363636363631 | D42: =RC[-1]^2 -> 1.5285950413223007E-2
A43: 42 | B43: 4.88 | C43: =R[1]C[-1]-R2C6 -> -0.11363636363636331 | D43: =RC[-1]^2 -> 1.2913223140495794E-2
A44: 43 | B44: 4.8899999999999997 | C44: =R[1]C[-1]-R2C6 -> -0.10363636363636264 | D44: =RC[-1]^2 -> 1.0740495867768388E-2
A45: 44 | B45: 4.9000000000000004 | C45: =R[1]C[-1]-R2C6 -> -0.10363636363636264 | D45: =RC[-1]^2 -> 1.0740495867768388E-2
A46: 45 | B46: 4.9000000000000004 | C46: =R[1]C[-1]-R2C6 -> -8.3636363636363065E-2 | D46: =RC[-1]^2 -> 6.9950413223139538E-3
A47: 46 | B47: 4.92 | C47: =R[1]C[-1]-R2C6 -> -8.3636363636363065E-2 | D47: =RC[-1]^2 -> 6.9950413223139538E-3
A48: 47 | B48: 4.92 | C48: =R[1]C[-1]-R2C6 -> -8.3636363636363065E-2 | D48: =RC[-1]^2 -> 6.9950413223139538E-3
A49: 48 | B49: 4.92 | C49: =R[1]C[-1]-R2C6 -> -7.3636363636363278E-2 | D49: =RC[-1]^2 -> 5.4223140495867237E-3
A50: 49 | B50: 4.93 | C50: =R[1]C[-1]-R2C6 -> -7.3636363636363278E-2 | D50: =RC[-1]^2 -> 5.4223140495867237E-3
A51: 50 | B51: 4.93 | C51: =R[1]C[-1]-R2C6 -> -5.3636363636362816E-2 | D51: =RC[-1]^2 -> 2.8768595041321434E-3
A52: 51 | B52: 4.95 | C52: =R[1]C[-1]-R2C6 -> -5.3636363636362816E-2 | D52: =RC[-1]^2 -> 2.8768595041321434E-3
A53: 52 | B53: 4.95 | C53: =R[1]C[-1]-R2C6 -> -4.3636363636363029E-2 | D53: =RC[-1]^2 -> 1.9041322314049057E-3
A54: 53 | B54: 4.96 | C54: =R[1]C[-1]-R2C6 -> -4.3636363636363029E-2 | D54: =RC[-1]^2 -> 1.9041322314049057E-3
A55: 54 | B55: 4.96 | C55: =R[1]C[-1]-R2C6 -> -4.3636363636363029E-2 | D55: =RC[-1]^2 -> 1.9041322314049057E-3
A56: 55 | B56: 4.96 | C56: =R[1]C[-1]-R2C6 -> -2.3636363636362567E-2 | D56: =RC[-1]^2 -> 5.5867768595036264E-4
A57: 56 | B57: 4.9800000000000004 | C57: =R[1]C[-1]-R2C6 -> -2.3636363636362567E-2 | D57: =RC[-1]^2 -> 5.5867768595036264E-4
A58: 57 | B58: 4.9800000000000004 | C58: =R[1]C[-1]-R2C6 -> -2.3636363636362567E-2 | D58: =RC[-1]^2 -> 5.5867768595036264E-4
A59: 58 | B59: 4.9800000000000004 | C59: =R[1]C[-1]-R2C6 -> -3.6363636363629936E-3 | D59: =RC[-1]^2 -> 1.3223140495863094E-5
A60: 59 | B60: 5 | C60: =R[1]C[-1]-R2C6 -> 1.636363636363658E-2 | D60: =RC[-1]^2 -> 2.677685950413294E-4
A61: 60 | B61: 5.0199999999999996 | C61: =R[1]C[-1]-R2C6 -> 1.636363636363658E-2 | D61: =RC[-1]^2 -> 2.677685950413294E-4
A62: 61 | B62: 5.0199999999999996 | C62: =R[1]C[-1]-R2C6 -> 2.6363636363637255E-2 | D62: =RC[-1]^2 -> 6.9504132231409661E-4
A63: 62 | B63: 5.03 | C63: =R[1]C[-1]-R2C6 -> 3.6363636363637042E-2 | D63: =RC[-1]^2 -> 1.3223140495868262E-3
A64: 63 | B64: 5.04 | C64: =R[1]C[-1]-R2C6 -> 3.6363636363637042E-2 | D64: =RC[-1]^2 -> 1.3223140495868262E-3
A65: 64 | B65: 5.04 | C65: =R[1]C[-1]-R2C6 -> 6.6363636363637291E-2 | D65: =RC[-1]^2 -> 4.4041322314050816E-3
A66: 65 | B66: 5.07 | C66: =R[1]C[-1]-R2C6 -> 7.6363636363637077E-2 | D66: =RC[-1]^2 -> 5.8314049586777952E-3
A67: 66 | B67: 5.08 | C67: =R[1]C[-1]-R2C6 -> 0.11636363636363711 | D67: =RC[-1]^2 -> 1.354049586776877E-2
A68: 67 | B68: 5.12 | C68: =R[1]C[-1]-R2C6 -> 0.1263636363636369 | D68: =RC[-1]^2 -> 1.5967768595041457E-2
A69: 68 | B69: 5.13 | C69: =R[1]C[-1]-R2C6 -> 0.1863636363636374 | D69: =RC[-1]^2 -> 3.4731404958678068E-2
A70: 69 | B70: 5.19 | C70: =R[1]C[-1]-R2C6 -> 0.19636363636363718 | D70: =RC[-1]^2 -> 3.8558677685950733E-2
A71: 70 | B71: 5.2 | C71: =R[1]C[-1]-R2C6 -> 0.23636363636363722 | D71: =RC[-1]^2 -> 5.5867768595041729E-2
A72: 71 | B72: 5.24 | C72: =R[1]C[-1]-R2C6 -> 0.23636363636363722 | D72: =RC[-1]^2 -> 5.5867768595041729E-2
A73: 72 | B73: 5.24 | C73: =R[1]C[-1]-R2C6 -> 0.24636363636363701 | D73: =RC[-1]^2 -> 6.0695041322314368E-2
A74: 73 | B74: 5.25 | C74: =R[1]C[-1]-R2C6 -> 0.24636363636363701 | D74: =RC[-1]^2 -> 6.0695041322314368E-2
A75: 74 | B75: 5.25 | C75: =R[1]C[-1]-R2C6 -> 0.26636363636363658 | D75: =RC[-1]^2 -> 7.0949586776859613E-2
A76: 75 | B76: 5.27 | C76: =R[1]C[-1]-R2C6 -> 0.26636363636363658 | D76: =RC[-1]^2 -> 7.0949586776859613E-2
A77: 76 | B77: 5.27 | C77: =R[1]C[-1]-R2C6 -> 0.36636363636363711 | D77: =RC[-1]^2 -> 0.13422231404958732
A78: 77 | B78: 5.37 | C78: =R[1]C[-1]-R2C6 -> 0.36636363636363711 | D78: =RC[-1]^2 -> 0.13422231404958732
A79: 78 | B79: 5.37 | C79: =R[1]C[-1]-R2C6 -> 0.3763636363636369 | D79: =RC[-1]^2 -> 0.1416495867768599
A80: 79 | B80: 5.38 | C80: =R[1]C[-1]-R2C6 -> 0.39636363636363736 | D80: =RC[-1]^2 -> 0.15710413223140576
A81: 80 | B81: 5.4 | C81: =R[1]C[-1]-R2C6 -> 0.39636363636363736 | D81: =RC[-1]^2 -> 0.15710413223140576
A82: 81 | B82: 5.4 | C82: =R[1]C[-1]-R2C6 -> 0.42636363636363672 | D82: =RC[-1]^2 -> 0.18178595041322346
A83: 82 | B83: 5.43 | C83: =R[1]C[-1]-R2C6 -> 0.42636363636363672 | D83: =RC[-1]^2 -> 0.18178595041322346
A84: 83 | B84: 5.43 | C84: =R[1]C[-1]-R2C6 -> 0.47636363636363743 | D84: =RC[-1]^2 -> 0.22692231404958779
A85: 84 | B85: 5.48 | C85: =R[1]C[-1]-R2C6 -> 0.49636363636363701 | D85: =RC[-1]^2 -> 0.24637685950413288
A86: 85 | B86: 5.5 | C86: =R[1]C[-1]-R2C6 -> 0.52636363636363726 | D86: =RC[-1]^2 -> 0.27705867768595133
A87: 86 | B87: 5.53 | C87: =R[1]C[-1]-R2C6 -> 0.53636363636363704 | D87: =RC[-1]^2 -> 0.28768595041322387
A88: 87 | B88: 5.54 | C88: =R[1]C[-1]-R2C6 -> 0.55636363636363662 | D88: =RC[-1]^2 -> 0.30954049586776888
A89: 88 | B89: 5.56 | C89: =R[1]C[-1]-R2C6 -> 0.66636363636363694 | D89: =RC[-1]^2 -> 0.44404049586776934
A90: 89 | B90: 5.67 | C90: =R[1]C[-1]-R2C6 -> 0.78636363636363704 | D90: =RC[-1]^2 -> 0.61836776859504239
A91: 90 | B91: 5.79 | C91: =R[1]C[-1]-R2C6 -> 0.79636363636363683 | D91: =RC[-1]^2 -> 0.63419504132231475
A92: 91 | B92: 5.8 | C92: =R[1]C[-1]-R2C6 -> 0.81636363636363729 | D92: =RC[-1]^2 -> 0.66644958677686106
A93: 92 | B93: 5.82 | C93: =R[1]C[-1]-R2C6 -> 0.85636363636363733 | D93: =RC[-1]^2 -> 0.73335867768595209
A94: 93 | B94: 5.86 | C94: =R[1]C[-1]-R2C6 -> 0.86636363636363711 | D94: =RC[-1]^2 -> 0.7505859504132244
A95: 94 | B95: 5.87 | C95: =R[1]C[-1]-R2C6 -> 0.99636363636363701 | D95: =RC[-1]^2 -> 0.99274049586776991
A96: 95 | B96: 6 | C96: =R[1]C[-1]-R2C6 -> 1.0263636363636373 | D96: =RC[-1]^2 -> 1.0534223140495886
A97: 96 | B97: 6.03 | C97: =R[1]C[-1]-R2C6 -> 1.0763636363636371 | D97: =RC[-1]^2 -> 1.158558677685952
A98: 97 | B98: 6.08 | C98: =R[1]C[-1]-R2C6 -> 1.0763636363636371 | D98: =RC[-1]^2 -> 1.158558677685952
A99: 98 | B99: 6.08 | C99: =R[1]C[-1]-R2C6 -> 1.1163636363636371 | D99: =RC[-1]^2 -> 1.246267768595043
A100: 99 | B100: 6.12 | C100: =R[1]C[-1]-R2C6 -> 0.14636363636363736 | D100: =RC[-1]^2 -> 2.1422314049587068E-2
A101: 100 | B101: 5.15 | C101: =R[-100]C[-1]-R2C6 -> -5.003636363636363 | D101: =RC[-1]^2 -> 25.036376859504127

Sheet: Лист2
A1: Границы интералов, с
A2: 4,28 - 4,42 | B2: 2 | C2: =RC[-1]/(100*Лист1!R2C11) -> -4.490510948905109E-2 | D2: =(4.42 + 4.28)/2 -> 4.3499999999999996 | E2: =R2C7*EXP(RC[4]) -> 0.36943547564992762 | G2: =1/(Лист1!RC[1]*SQRT((2*PI()))) -> 0.58295498946355251 | H2: =2*(Лист1!RC)^2 -> 0.93665591451707175 | I2: =-((RC[-5] - Лист1!R2C6)^2)/R2C8 -> -0.45613387931047034
A3: 4,42 - 4,56 | B3: 3 | C3: =RC[-1]/(100*Лист1!R2C11) -> -6.7357664233576642E-2 | D3: =(4.56 + 4.42)/2 -> 4.49 | E3: =R2C7*EXP(RC[4]) -> 0.43985534502891205 | I3: =-((RC[-5] - Лист1!R2C6)^2)/R2C8 -> -0.28166406677270533
A4: 4,56 - 4,70 | B4: 1 | C4: =RC[-1]/(100*Лист1!R2C11) -> -2.2452554744525545E-2 | D4: =(4.56 + 4.7)/2 -> 4.63 | E4: =R2C7*EXP(RC[4]) -> 0.50223327845767152 | I4: =-((RC[-5] - Лист1!R2C6)^2)/R2C8 -> -0.14904526845739582
A5: 4,70 - 4,84 | B5: 2 | C5: =RC[-1]/(100*Лист1!R2C11) -> -4.490510948905109E-2 | D5: =(4.7 + 4.84)/2 -> 4.7699999999999996 | E5: =R2C7*EXP(RC[4]) -> 0.54995282068185203 | I5: =-((RC[-5] - Лист1!R2C6)^2)/R2C8 -> -5.8277484364540506E-2
A6: 4,84 - 4,98 | B6: 31 | C6: =RC[-1]/(100*Лист1!R2C11) -> -0.69602919708029187 | D6: =(4.84+4.98)/2 -> 4.91 | E6: =R2C7*EXP(RC[4]) -> 0.57752357486459827 | I6: =-((RC[-5] - Лист1!R2C6)^2)/R2C8 -> -9.3607144941392148E-3
A7: 4,98 - 5,12 | B7: 44 | C7: =RC[-1]/(100*Лист1!R2C11) -> -0.98791240875912401 | D7: =(4.98+5.12)/2 -> 5.0500000000000007 | E7: =R2C7*EXP(RC[4]) -> 0.5816186657440382 | I7: =-((RC[-5] - Лист1!R2C6)^2)/R2C8 -> -2.2949588461926599E-3
A8: 5,12 - 5,26 | B8: 12 | C8: =RC[-1]/(100*Лист1!R2C11) -> -0.26943065693430657 | D8: =(5.12 + 5.4)/2 -> 5.26 | E8: =R2C7*EXP(RC[4]) -> 0.54345287772898709 | I8: =-((RC[-5] - Лист1!R2C6)^2)/R2C8 -> -7.0166977041374479E-2
A9: 5,26 - 5,40 | B9: 3 | C9: =RC[-1]/(100*Лист1!R2C11) -> -6.7357664233576642E-2 | D9: =(5.26 + 5.4)/2 -> 5.33 | E9: =R2C7*EXP(RC[4]) -> 0.52029371471995678 | I9: =-((RC[-5] - Лист1!R2C6)^2)/R2C8 -> -0.11371649021766252
A10: 5,40 - 5,54 | B10: 1 | C10: =RC[-1]/(100*Лист1!R2C11) -> -2.2452554744525545E-2 | D10: =(5.4 + 5.54)/2 -> 5.4700000000000006 | E10: =R2C7*EXP(RC[4]) -> 0.46215771213949897 | I10: =-((RC[-5] - Лист1!R2C6)^2)/R2C8 -> -0.23220377723707966
A11: 5,54 - 5,68 | B11: 1 | C11: =RC[-1]/(100*Лист1!R2C11) -> -2.2452554744525545E-2 | D11: =(5.54+5.68)/2 -> 5.6099999999999994 | E11: =R2C7*EXP(RC[4]) -> 0.39369161502913363 | I11: =-((RC[-5] - Лист1!R2C6)^2)/R2C8 -> -0.39254207847894917
D14: 7.1999999999999995E-2
D15: 7.1999999999999995E-2
D16: 7.1999999999999995E-2
D17: 0.14299999999999999
D18: 0.14299999999999999
D19: 0.215
D20: 0.215
D21: 0.85799999999999998
D22: 2.218
D23: 3.1480000000000001

Sheet: Лист3
B1: Интервал, с
B2: от | C2: до
B3: =Лист1!R[-1]C[4] - Лист1!R[-1]C[6] -> 4.3192914526020694 | C3: =Лист1!R[-1]C[3] + Лист1!R[-1]C[5] -> 5.6879812746706566 | D3: 88 | E3: =RC[-1]/100 -> 0.88 | F3: 0.68300000000000005
B4: =Лист1!R[-2]C[4] - 2*(Лист1!R[-2]C[6]) -> 3.6349465415677749 | C4: =Лист1!R[-2]C[3] + 2*(Лист1!R[-2]C[5]) -> 6.3723261857049511 | D4: 92 | E4: =RC[-1]/100 -> 0.92 | F4: 0.95399999999999996
B5: =Лист1!R[-3]C[4] - 3*(Лист1!R[-3]C[6]) -> 2.9506016305334808 | C5: =Лист1!R[-3]C[3] + 3*( Лист1!R[-3]C[5]) -> 7.0566710967392456 | D5: 98 | E5: =RC[-1]/100 -> 0.98 | F5: 0.997